{
  "id": "LIS-8fbd3ce1-test_0",
  "module": "LISTENING",
  "title": "IELTS Listening Test",
  "testType": "ACADEMIC",
  "sections": [
    {
      "id": "LIS-8fbd3ce1-test_0-S1",
      "testId": "LIS-8fbd3ce1-test_0",
      "sectionNumber": 1,
      "audio": {
        "id": "f2852b413c46",
        "path": "assets/f2852b413c46.mp3",
        "exists": true,
        "originalSrc": "../wp-content/uploads/audio/184_we-q7b50db1914.mp3"
      },
      "questionGroups": [
        {
          "id": "LIS-8fbd3ce1-test_0-S1-G1",
          "questionType": "NOTE_COMPLETION",
          "instruction": "Part 1:Questions 1-10Complete the notes below. WriteONE WORD AND/ OR A NUMBERfor each answer.",
          "sharedContent": "<p style=\"text-align: justify;\"><strong>Customer Satisfaction Survey</strong></p><p style=\"text-align: justify;\"><strong>Customer details</strong><br/>Name: Sophie Bird<br/>Occupation: (1) <input name=\"fname\" type=\"text\"/><br/>Reason for travel today: (2) <input name=\"fname\" type=\"text\"/></p><p style=\"text-align: justify;\"><strong>Journey information</strong><br/>Name of station returning to: (3) <input name=\"fname\" type=\"text\"/><br/>Type of ticket purchased: standard (4) <input name=\"fname\" type=\"text\"/> ticket<br/>Cost of ticket: (5) £ <input name=\"fname\" type=\"text\"/><br/>When ticket was purchased: yesterday<br/>Where ticket was bought: (6) <input name=\"fname\" type=\"text\"/></p><p style=\"text-align: justify;\"><strong>Satisfaction with journey:</strong><br/>Most satisfied with: the wifi<br/>Least satisfied with: the (7) <input name=\"fname\" type=\"text\"/> this morning</p><p style=\"text-align: justify;\"><strong>Satisfaction with station facilities</strong><br/>Most satisfied with: how much (8) <input name=\"fname\" type=\"text\"/> was provided<br/>Least satisfied with: lack of seats, particularly on the (9) <input name=\"fname\" type=\"text\"/><br/>Neither satisfied nor dissatisfied with: the (10) <input name=\"fname\" type=\"text\"/> available</p><p><br/></p>",
          "sharedOptions": [],
          "questions": [
            {
              "id": "LIS-8fbd3ce1-test_0-S1-Q01",
              "module": "LISTENING",
              "testId": "LIS-8fbd3ce1-test_0",
              "testType": "ACADEMIC",
              "sectionId": "LIS-8fbd3ce1-test_0-S1",
              "sectionNumber": 1,
              "passageId": null,
              "passageNumber": null,
              "groupId": "LIS-8fbd3ce1-test_0-S1-G1",
              "questionNumber": 1,
              "questionType": "NOTE_COMPLETION",
              "inputType": "INLINE_BLANK",
              "prompt": "Occupation: [INLINE_INPUT_1]",
              "options": [],
              "sharedInstruction": "Part 1:Questions 1-10Complete the notes below. WriteONE WORD AND/ OR A NUMBERfor each answer.",
              "sharedContent": "<p style=\"text-align: justify;\"><strong>Customer Satisfaction Survey</strong></p><p style=\"text-align: justify;\"><strong>Customer details</strong><br/>Name: Sophie Bird<br/>Occupation: (1) <input name=\"fname\" type=\"text\"/><br/>Reason for travel today: (2) <input name=\"fname\" type=\"text\"/></p><p style=\"text-align: justify;\"><strong>Journey information</strong><br/>Name of station returning to: (3) <input name=\"fname\" type=\"text\"/><br/>Type of ticket purchased: standard (4) <input name=\"fname\" type=\"text\"/> ticket<br/>Cost of ticket: (5) £ <input name=\"fname\" type=\"text\"/><br/>When ticket was purchased: yesterday<br/>Where ticket was bought: (6) <input name=\"fname\" type=\"text\"/></p><p style=\"text-align: justify;\"><strong>Satisfaction with journey:</strong><br/>Most satisfied with: the wifi<br/>Least satisfied with: the (7) <input name=\"fname\" type=\"text\"/> this morning</p><p style=\"text-align: justify;\"><strong>Satisfaction with station facilities</strong><br/>Most satisfied with: how much (8) <input name=\"fname\" type=\"text\"/> was provided<br/>Least satisfied with: lack of seats, particularly on the (9) <input name=\"fname\" type=\"text\"/><br/>Neither satisfied nor dissatisfied with: the (10) <input name=\"fname\" type=\"text\"/> available</p><p><br/></p>",
              "correctAnswer": "journalist",
              "audioId": "f2852b413c46",
              "audioPath": "assets/f2852b413c46.mp3",
              "tableData": null,
              "sourceEvidence": {
                "sourceFile": "/Users/arunyagoojar/Downloads/ielts-website/ielts-listening-test-184/index.html",
                "sourceHash": "8fbd3ce10e9c635146dbb171c0efac83817d73756737757a6939679bff6189a3"
              },
              "status": "VERIFIED"
            },
            {
              "id": "LIS-8fbd3ce1-test_0-S1-Q02",
              "module": "LISTENING",
              "testId": "LIS-8fbd3ce1-test_0",
              "testType": "ACADEMIC",
              "sectionId": "LIS-8fbd3ce1-test_0-S1",
              "sectionNumber": 1,
              "passageId": null,
              "passageNumber": null,
              "groupId": "LIS-8fbd3ce1-test_0-S1-G1",
              "questionNumber": 2,
              "questionType": "NOTE_COMPLETION",
              "inputType": "INLINE_BLANK",
              "prompt": "Reason for travel today: [INLINE_INPUT_2]",
              "options": [],
              "sharedInstruction": "Part 1:Questions 1-10Complete the notes below. WriteONE WORD AND/ OR A NUMBERfor each answer.",
              "sharedContent": "<p style=\"text-align: justify;\"><strong>Customer Satisfaction Survey</strong></p><p style=\"text-align: justify;\"><strong>Customer details</strong><br/>Name: Sophie Bird<br/>Occupation: (1) <input name=\"fname\" type=\"text\"/><br/>Reason for travel today: (2) <input name=\"fname\" type=\"text\"/></p><p style=\"text-align: justify;\"><strong>Journey information</strong><br/>Name of station returning to: (3) <input name=\"fname\" type=\"text\"/><br/>Type of ticket purchased: standard (4) <input name=\"fname\" type=\"text\"/> ticket<br/>Cost of ticket: (5) £ <input name=\"fname\" type=\"text\"/><br/>When ticket was purchased: yesterday<br/>Where ticket was bought: (6) <input name=\"fname\" type=\"text\"/></p><p style=\"text-align: justify;\"><strong>Satisfaction with journey:</strong><br/>Most satisfied with: the wifi<br/>Least satisfied with: the (7) <input name=\"fname\" type=\"text\"/> this morning</p><p style=\"text-align: justify;\"><strong>Satisfaction with station facilities</strong><br/>Most satisfied with: how much (8) <input name=\"fname\" type=\"text\"/> was provided<br/>Least satisfied with: lack of seats, particularly on the (9) <input name=\"fname\" type=\"text\"/><br/>Neither satisfied nor dissatisfied with: the (10) <input name=\"fname\" type=\"text\"/> available</p><p><br/></p>",
              "correctAnswer": "shopping",
              "audioId": "f2852b413c46",
              "audioPath": "assets/f2852b413c46.mp3",
              "tableData": null,
              "sourceEvidence": {
                "sourceFile": "/Users/arunyagoojar/Downloads/ielts-website/ielts-listening-test-184/index.html",
                "sourceHash": "8fbd3ce10e9c635146dbb171c0efac83817d73756737757a6939679bff6189a3"
              },
              "status": "VERIFIED"
            },
            {
              "id": "LIS-8fbd3ce1-test_0-S1-Q03",
              "module": "LISTENING",
              "testId": "LIS-8fbd3ce1-test_0",
              "testType": "ACADEMIC",
              "sectionId": "LIS-8fbd3ce1-test_0-S1",
              "sectionNumber": 1,
              "passageId": null,
              "passageNumber": null,
              "groupId": "LIS-8fbd3ce1-test_0-S1-G1",
              "questionNumber": 3,
              "questionType": "NOTE_COMPLETION",
              "inputType": "INLINE_BLANK",
              "prompt": "Name of station returning to: [INLINE_INPUT_3]",
              "options": [],
              "sharedInstruction": "Part 1:Questions 1-10Complete the notes below. WriteONE WORD AND/ OR A NUMBERfor each answer.",
              "sharedContent": "<p style=\"text-align: justify;\"><strong>Customer Satisfaction Survey</strong></p><p style=\"text-align: justify;\"><strong>Customer details</strong><br/>Name: Sophie Bird<br/>Occupation: (1) <input name=\"fname\" type=\"text\"/><br/>Reason for travel today: (2) <input name=\"fname\" type=\"text\"/></p><p style=\"text-align: justify;\"><strong>Journey information</strong><br/>Name of station returning to: (3) <input name=\"fname\" type=\"text\"/><br/>Type of ticket purchased: standard (4) <input name=\"fname\" type=\"text\"/> ticket<br/>Cost of ticket: (5) £ <input name=\"fname\" type=\"text\"/><br/>When ticket was purchased: yesterday<br/>Where ticket was bought: (6) <input name=\"fname\" type=\"text\"/></p><p style=\"text-align: justify;\"><strong>Satisfaction with journey:</strong><br/>Most satisfied with: the wifi<br/>Least satisfied with: the (7) <input name=\"fname\" type=\"text\"/> this morning</p><p style=\"text-align: justify;\"><strong>Satisfaction with station facilities</strong><br/>Most satisfied with: how much (8) <input name=\"fname\" type=\"text\"/> was provided<br/>Least satisfied with: lack of seats, particularly on the (9) <input name=\"fname\" type=\"text\"/><br/>Neither satisfied nor dissatisfied with: the (10) <input name=\"fname\" type=\"text\"/> available</p><p><br/></p>",
              "correctAnswer": "Staunfirth",
              "audioId": "f2852b413c46",
              "audioPath": "assets/f2852b413c46.mp3",
              "tableData": null,
              "sourceEvidence": {
                "sourceFile": "/Users/arunyagoojar/Downloads/ielts-website/ielts-listening-test-184/index.html",
                "sourceHash": "8fbd3ce10e9c635146dbb171c0efac83817d73756737757a6939679bff6189a3"
              },
              "status": "VERIFIED"
            },
            {
              "id": "LIS-8fbd3ce1-test_0-S1-Q04",
              "module": "LISTENING",
              "testId": "LIS-8fbd3ce1-test_0",